{"base_track":"","corners":["sharp","sharp","sharp","sharp","sharp","sharp","sharp","sharp","sharp","sharp","sharp","sharp","sharp","sharp","sharp","sharp","sharp","sharp","sharp","sharp","sharp","sharp","sharp","sharp","sharp","sharp","sharp","sharp","sharp","sharp","sharp","sharp","sharp","sharp","sharp","sharp","sharp","sharp","sharp","sharp","sharp","sharp","sharp","sharp","sharp","sharp","sharp","sharp","sharp","sharp","sharp","sharp","sharp","sharp","sharp","sharp","sharp","sharp","sharp","sharp","sharp","sharp","sharp","sharp","sharp","sharp","sharp","sharp","sharp","sharp","sharp","sharp","sharp","sharp","sharp","sharp","sharp","sharp","sharp","sharp","sharp","sharp","sharp","sharp","sharp","sharp","sharp","sharp","sharp","sharp","sharp","sharp","sharp","sharp","sharp","sharp"],"creator":"Beat my track","id":"track_a79a49980a6e4158","layout":{},"name":"My way","objects":[],"paint":[],"pieces":[{"flip":false,"heading":0.443124690743003,"kind":"bridge","length":60.3907241821289,"position":[-22.8889141082764,24.0329437255859],"radius":16.0,"width":10.0},{"flip":false,"heading":0.289008622475953,"kind":"bridge","length":60.0872039794922,"position":[-22.5864429473877,7.69691228866577],"radius":16.0,"width":10.0},{"flip":false,"heading":359.999999332989,"kind":"hairpin","length":3.5,"position":[37.5,8.0],"radius":8.25,"width":10.5},{"angle":270.0,"flip":false,"heading":88.8203062684198,"kind":"curve","length":0.0,"position":[-9.80721473693848,36.5867462158203],"radius":12.8204689359203,"width":10.5},{"flip":false,"heading":90.1070378653529,"kind":"straight","length":80.9560699462891,"position":[-9.65598011016846,-44.3691825866699],"radius":16.0,"width":10.5},{"flip":false,"heading":179.778001189532,"kind":"hairpin","length":20.5,"position":[-22.5864429473877,7.69691228866577],"radius":8.67733383178711,"width":10.5},{"flip":false,"heading":1.06428728018648,"kind":"straight","length":60.6551319765955,"position":[-22.6536865234375,-9.65762519836426],"radius":16.0,"width":10.5},{"curvature":0.3,"flip":true,"heading":0.672300402522344,"kind":"curve","length":0.0,"position":[37.9909820556641,-8.53100204467773],"radius":20.9285843260196,"width":10.5},{"flip":true,"heading":284.472249686335,"height":25.7759525716062,"kind":"s_bend","length":2.0,"position":[59.1636962890625,-29.2125797271729],"radius":15.7981644793716,"width":10.5},{"flip":false,"heading":302.915398836997,"kind":"hairpin","length":12.5,"position":[40.7887954711914,-61.1603851318359],"radius":8.73741149902344,"width":12.0},{"flip":false,"heading":118.423254709979,"kind":"curve","length":0.0,"position":[55.4584541320801,-51.6645660400391],"radius":30.5158996446515,"width":12.0},{"curvature":0.25,"flip":false,"heading":221.65384894601,"kind":"curve","length":0.0,"position":[14.0960884094238,-39.3521881103516],"radius":12.8250528964031,"width":12.0},{"flip":true,"heading":318.483794790534,"kind":"curve","length":0.0,"position":[13.0374422073364,-57.4586296081543],"radius":20.2379863988746,"width":12.0},{"angle":135.0,"curvature":0.3,"flip":true,"heading":226.09074666104,"kind":"curve","length":0.0,"position":[14.7766246795654,-86.0265731811523],"radius":15.0331731365273,"width":12.0},{"flip":false,"heading":87.4052286650934,"kind":"straight","length":31.5501289367676,"position":[-11.0843105316162,-75.886962890625],"radius":16.0,"width":12.0}],"points":[[-22.8889141082764,24.0329437255859],[-15.2500658035278,24.0920238494873],[-7.6112174987793,24.1511039733887],[0.0276309847831726,24.2101821899414],[7.66647911071777,24.2692642211914],[15.3053274154663,24.3283443450928],[22.9441757202148,24.3874244689941],[30.5830249786377,24.4465026855469],[38.2218933105469,24.5],[45.5813980102539,23.1011810302734],[49.2341156005859,16.7043304443359],[46.3092765808105,9.9424877166748],[39.131233215332,8.0],[31.4922332763672,7.96969604492188],[23.8532543182373,7.93116331100464],[16.2142753601074,7.8926305770874],[8.57529449462891,7.85409784317017],[0.93631500005722,7.81556558609009],[-6.70266485214233,7.77703332901001],[-14.3416442871094,7.73850059509277],[-21.9806251525879,7.69996786117554],[-29.6196403503418,7.72416353225708],[-37.258659362793,7.75376272201538],[-44.8842163085938,7.58722066879272],[-50.791690826416,3.14427042007446],[-51.1232109069824,-4.240966796875],[-45.6389656066895,-9.19657421112061],[-38.0383224487305,-9.59801292419434],[-30.3993015289307,-9.62761402130127],[-22.7602825164795,-9.65721225738525],[-15.1225051879883,-9.51771450042725],[-7.48474597930908,-9.37582492828369],[0.15301325917244,-9.23393440246582],[7.79077243804932,-9.09204387664795],[15.4285316467285,-8.95015430450439],[23.0662899017334,-8.80826473236084],[30.7040500640869,-8.66637420654297],[38.3417625427246,-8.52229881286621],[45.8718605041504,-7.28465843200684],[53.4256210327148,-7.68322896957397],[59.0990295410156,-12.5082159042358],[60.3657302856445,-19.9417095184326],[59.2398948669434,-27.4938488006592],[59.412410736084,-35.0029525756836],[55.0209846496582,-41.1690330505371],[49.0083389282227,-45.8662109375],[43.2957000732422,-50.9108581542969],[40.1112098693848,-57.6859893798828],[43.0095329284668,-64.5910949707031],[47.1606063842773,-71.00390625],[53.0925750732422,-75.4447631835938],[60.2971382141113,-73.7798538208008],[63.6451759338379,-67.1858520507812],[60.9788627624512,-60.1927947998047],[56.8277854919434,-53.7799911499023],[52.6554412841797,-47.3881683349609],[47.2491722106934,-42.0194244384766],[40.6803016662598,-38.1593132019043],[33.3603477478027,-36.0462074279785],[25.7451667785645,-35.8116226196289],[18.3089694976807,-37.4701843261719],[11.6711025238037,-41.1488723754883],[6.80898904800415,-46.8037376403809],[9.06160736083984,-53.7419281005859],[14.5973148345947,-58.998592376709],[18.5585346221924,-65.4771270751953],[19.854944229126,-72.9587631225586],[18.3052787780762,-80.3925094604492],[14.1113920211792,-86.7204513549805],[8.52324676513672,-91.90869140625],[1.45104253292084,-94.5224227905273],[-5.71811962127686,-92.382194519043],[-10.0174150466919,-86.2119674682617],[-11.0390710830688,-78.6726379394531],[-10.8646049499512,-71.0389099121094],[-10.5187702178955,-63.4076652526855],[-10.1729345321655,-55.7764205932617],[-9.82709980010986,-48.1451759338379],[-9.66318988800049,-40.5099830627441],[-9.67746067047119,-32.8709182739258],[-9.69173240661621,-25.2318553924561],[-9.70600318908691,-17.5927925109863],[-9.72027397155762,-9.9537296295166],[-9.73454570770264,-2.31466579437256],[-9.74881649017334,5.32439756393433],[-9.76308727264404,12.9634609222412],[-9.77735900878906,20.6025238037109],[-9.79162979125977,28.2415885925293],[-9.80590057373047,35.8806495666504],[-11.5046901702881,43.2215538024902],[-16.9978199005127,48.3642311096191],[-24.4304161071777,49.539680480957],[-31.2433605194092,46.3413887023926],[-35.0811042785645,39.8672294616699],[-34.6260147094727,32.3562126159668],[-30.0354480743408,26.3937950134277]],"route_override":true,"schema":"creator-track-v5","start_line":{"heading":90.1070793800965,"position":[-9.69943332672119,-21.1093463897705]},"surface":"asphalt","theme":"desert","width":10.0,"widths":[10.25,10.0033149719238,10.0,10.0,10.0,10.0,10.0,10.0033149719238,10.255407333374,10.4999599456787,10.5,10.5,10.2926359176636,10.041389465332,10.0,10.0,10.0,10.0,10.0,10.0,10.2439498901367,10.479419708252,10.5,10.5,10.5,10.5,10.5,10.5,10.5,10.5,10.5,10.5,10.5,10.5,10.5,10.5,10.5,10.5,10.5,10.5,10.5,10.5,10.5,10.5,10.5,10.5,10.5,10.842059135437,11.5796031951904,12.0,12.0,12.0,12.0,12.0,12.0,12.0,12.0,12.0,12.0,12.0,12.0,12.0,12.0,12.0,12.0,12.0,12.0,12.0,12.0,12.0,12.0,12.0,12.0,12.0,12.0,12.0,12.0,11.6813879013062,10.9103956222534,10.5,10.5,10.5,10.5,10.5,10.5,10.5,10.5,10.5,10.5,10.5,10.5,10.5,10.5,10.5,10.5,10.5]}