{
  "base_track": "",
  "corners": [
    "sharp",
    "sharp",
    "sharp",
    "sharp",
    "sharp",
    "sharp",
    "sharp",
    "sharp",
    "sharp",
    "sharp",
    "sharp",
    "sharp",
    "sharp",
    "sharp",
    "sharp",
    "sharp",
    "sharp",
    "sharp",
    "sharp",
    "sharp",
    "sharp",
    "sharp",
    "sharp",
    "sharp",
    "sharp",
    "sharp",
    "sharp",
    "sharp",
    "sharp",
    "sharp",
    "sharp",
    "sharp",
    "sharp",
    "sharp",
    "sharp",
    "sharp",
    "sharp",
    "sharp",
    "sharp",
    "sharp",
    "sharp",
    "sharp",
    "sharp",
    "sharp",
    "sharp",
    "sharp",
    "sharp",
    "sharp",
    "sharp",
    "sharp",
    "sharp",
    "sharp",
    "sharp",
    "sharp",
    "sharp",
    "sharp",
    "sharp",
    "sharp",
    "sharp",
    "sharp",
    "sharp",
    "sharp",
    "sharp",
    "sharp",
    "sharp",
    "sharp",
    "sharp",
    "sharp",
    "sharp",
    "sharp",
    "sharp",
    "sharp",
    "sharp",
    "sharp",
    "sharp",
    "sharp",
    "sharp",
    "sharp",
    "sharp",
    "sharp",
    "sharp",
    "sharp",
    "sharp",
    "sharp",
    "sharp"
  ],
  "id": "spline_test",
  "layout": {},
  "name": "Five point spline",
  "objects": [],
  "paint": [],
  "pieces": [
    {
      "flip": false,
      "heading": 0.0,
      "kind": "spline",
      "length": 0.0,
      "point_widths": [
        10.0,
        6.0,
        20.0,
        7.0,
        12.0
      ],
      "position": [
        -24.0,
        -18.0
      ],
      "radius": 18.0,
      "spline_points": [
        [
          0.0,
          0.0
        ],
        [
          12.0,
          0.0
        ],
        [
          24.0,
          8.0
        ],
        [
          36.0,
          0.0
        ],
        [
          48.0,
          0.0
        ]
      ],
      "width": 20.0
    },
    {
      "flip": false,
      "heading": 0.0,
      "kind": "hairpin",
      "length": 0.0,
      "position": [
        24.0,
        -18.0
      ],
      "radius": 18.0,
      "width": 10.0
    },
    {
      "flip": false,
      "heading": 180.0,
      "kind": "straight",
      "length": 48.0,
      "position": [
        24.0,
        18.0
      ],
      "radius": 18.0,
      "width": 10.0
    },
    {
      "flip": false,
      "heading": 180.0,
      "kind": "hairpin",
      "length": 0.0,
      "position": [
        -24.0,
        17.9999961853027
      ],
      "radius": 18.0,
      "width": 10.0
    }
  ],
  "points": [
    [
      -24.0,
      -18.0
    ],
    [
      -21.4795875549316,
      -18.1199588775635
    ],
    [
      -18.9662170410156,
      -18.350923538208
    ],
    [
      -16.4476795196533,
      -18.5091209411621
    ],
    [
      -13.928316116333,
      -18.4010200500488
    ],
    [
      -11.4804496765137,
      -17.8140716552734
    ],
    [
      -9.31784057617188,
      -16.5265235900879
    ],
    [
      -7.39427614212036,
      -14.8938989639282
    ],
    [
      -5.54735898971558,
      -13.173641204834
    ],
    [
      -3.62715005874634,
      -11.5370998382568
    ],
    [
      -1.45048904418945,
      -10.2776165008545
    ],
    [
      1.02649307250977,
      -10.1426601409912
    ],
    [
      3.2677013874054,
      -11.2744884490967
    ],
    [
      5.21845865249634,
      -12.8736085891724
    ],
    [
      7.06724262237549,
      -14.5918312072754
    ],
    [
      8.96588706970215,
      -16.2539215087891
    ],
    [
      11.0739688873291,
      -17.632682800293
    ],
    [
      13.4875745773315,
      -18.3384189605713
    ],
    [
      16.0025405883789,
      -18.5152454376221
    ],
    [
      18.5226917266846,
      -18.38942527771
    ],
    [
      21.0360126495361,
      -18.1578674316406
    ],
    [
      23.5548400878906,
      -18.0047950744629
    ],
    [
      26.0740432739258,
      -17.8775787353516
    ],
    [
      28.5524711608887,
      -17.4123821258545
    ],
    [
      30.9410209655762,
      -16.603832244873
    ],
    [
      33.1953277587891,
      -15.4735422134399
    ],
    [
      35.2658538818359,
      -14.033974647522
    ],
    [
      37.1173667907715,
      -12.3220367431641
    ],
    [
      38.7115821838379,
      -10.3681898117065
    ],
    [
      40.0146903991699,
      -8.20927333831787
    ],
    [
      41.0076179504395,
      -5.89121770858765
    ],
    [
      41.6617126464844,
      -3.45576620101929
    ],
    [
      41.9716262817383,
      -0.953214228153229
    ],
    [
      41.930046081543,
      1.56817293167114
    ],
    [
      41.5325736999512,
      4.05838251113892
    ],
    [
      40.7954597473145,
      6.46998023986816
    ],
    [
      39.7247924804688,
      8.75313949584961
    ],
    [
      38.3468170166016,
      10.8650074005127
    ],
    [
      36.6890144348145,
      12.7652530670166
    ],
    [
      34.7785568237305,
      14.411280632019
    ],
    [
      32.6593780517578,
      15.7780704498291
    ],
    [
      30.3687286376953,
      16.8325748443604
    ],
    [
      27.9533157348633,
      17.5568790435791
    ],
    [
      25.4608192443848,
      17.9401111602783
    ],
    [
      22.938383102417,
      18.0
    ],
    [
      20.4144077301025,
      18.0
    ],
    [
      17.8904304504395,
      18.0
    ],
    [
      15.366455078125,
      18.0
    ],
    [
      12.8424787521362,
      17.9999980926514
    ],
    [
      10.3185024261475,
      17.9999980926514
    ],
    [
      7.79452610015869,
      17.9999980926514
    ],
    [
      5.27055025100708,
      17.9999980926514
    ],
    [
      2.74657416343689,
      17.9999980926514
    ],
    [
      0.22259795665741,
      17.9999980926514
    ],
    [
      -2.30137825012207,
      17.9999980926514
    ],
    [
      -4.82535457611084,
      17.9999980926514
    ],
    [
      -7.34933042526245,
      17.9999980926514
    ],
    [
      -9.87330627441406,
      17.9999961853027
    ],
    [
      -12.3972826004028,
      17.9999961853027
    ],
    [
      -14.9212589263916,
      17.9999961853027
    ],
    [
      -17.4452342987061,
      17.9999961853027
    ],
    [
      -19.9692115783691,
      17.9999961853027
    ],
    [
      -22.4931869506836,
      17.9999961853027
    ],
    [
      -25.0164794921875,
      17.9676933288574
    ],
    [
      -27.5180606842041,
      17.6499862670898
    ],
    [
      -29.9507312774658,
      16.9857978820801
    ],
    [
      -32.2656326293945,
      15.9856777191162
    ],
    [
      -34.420524597168,
      14.6758184432983
    ],
    [
      -36.3677749633789,
      13.0734767913818
    ],
    [
      -38.0739326477051,
      11.2166423797607
    ],
    [
      -39.5048561096191,
      9.14020919799805
    ],
    [
      -40.6280899047852,
      6.88245344161987
    ],
    [
      -41.4292068481445,
      4.49135255813599
    ],
    [
      -41.8841171264648,
      2.01098847389221
    ],
    [
      -41.9894866943359,
      -0.508476853370667
    ],
    [
      -41.7440490722656,
      -3.01825547218323
    ],
    [
      -41.145378112793,
      -5.46791744232178
    ],
    [
      -40.2145957946777,
      -7.81156444549561
    ],
    [
      -38.9627304077148,
      -10.000602722168
    ],
    [
      -37.4175720214844,
      -11.9934206008911
    ],
    [
      -35.6114463806152,
      -13.7533340454102
    ],
    [
      -33.5734329223633,
      -15.2385606765747
    ],
    [
      -31.3501377105713,
      -16.4284782409668
    ],
    [
      -28.981689453125,
      -17.2941989898682
    ],
    [
      -26.5153675079346,
      -17.8196830749512
    ]
  ],
  "route_override": true,
  "schema": "creator-track-v5",
  "surface": "asphalt",
  "theme": "pine",
  "width": 10.0,
  "widths": [
    10.0,
    9.18162155151367,
    8.35551357269287,
    7.53408241271973,
    6.72511386871338,
    6.48000240325928,
    8.8031005859375,
    11.0715532302856,
    13.7056427001953,
    15.9549226760864,
    18.454309463501,
    19.1918926239014,
    16.9791851043701,
    14.6908159255981,
    12.5244197845459,
    10.3765230178833,
    7.90272665023804,
    7.60507202148438,
    8.61259078979492,
    9.90696334838867,
    10.882043838501,
    11.0086221694946,
    10.9090795516968,
    10.4133806228638,
    10.0710372924805,
    10.0,
    10.0,
    10.0,
    10.0,
    10.0,
    10.0,
    10.0,
    10.0,
    10.0,
    10.0,
    10.0,
    10.0,
    10.0,
    10.0,
    10.0,
    10.0,
    10.0,
    10.0,
    10.0,
    10.0,
    10.0,
    10.0,
    10.0,
    10.0,
    10.0,
    10.0,
    10.0,
    10.0,
    10.0,
    10.0,
    10.0,
    10.0,
    10.0,
    10.0,
    10.0,
    10.0,
    10.0,
    10.0,
    10.0,
    10.0,
    10.0,
    10.0,
    10.0,
    10.0,
    10.0,
    10.0,
    10.0,
    10.0,
    10.0,
    10.0,
    10.0,
    10.0,
    10.0,
    10.0,
    10.0,
    10.0,
    10.0,
    10.0,
    10.0,
    10.0
  ],
  "start_line": {
    "position": [
      -24.0,
      -18.0
    ],
    "heading": 0.0
  }
}
